{
  "schema_version": "1.4",
  "decision_id": "DEC-20260301-302",
  "decision_key": "f8:multiasset:fii_br",
  "title": "Promocao sintetica de fii_br para fixture positiva",
  "proposal": "Representar aprovacao R3 sintetica para validar o checker multiasset.",
  "risk_class": "alto",
  "risk_tier": "R3",
  "data_sensitivity": "internal",
  "status": "APPROVED",
  "created_at": "2026-03-01T12:05:00-0300",
  "timeout_at": "2026-03-01T16:05:00-0300",
  "approver_operator_id": "fixture-operator",
  "approver_channel": "telegram",
  "approver_telegram_user_id": "1002",
  "approver_telegram_chat_id": "2002",
  "approver_slack_user_id": null,
  "approver_slack_channel_id": null,
  "auth_method": "telegram_allowlist",
  "last_command_id": "CMD-F8-04-302",
  "side_effect_class": "financial",
  "explicit_human_approval": true,
  "approval_evidence_ref": "artifacts/phase-f8/epic-f8-04-issue-03-shadow-r3-promote-hold.md",
  "approval_signature_valid": true,
  "challenge_id": "CHL-F8-04-302",
  "challenge_status": "VALIDATED",
  "challenge_expires_at": "2026-03-01T16:05:00-0300"
}
